<?xml version="1.0" encoding="UTF-8"?>
<!DOCTYPE mail SYSTEM '01.dtd'>


	<mail xmlns:xsi='http://www.w3.org/2001/XMLSchema-instance'
    xsi:noNamespaceSchemaLocation='esquema1.xsd'>
		<remitente>perico@gmail.com</remitente>
		<destinatario>ambrosio@gmail.com</destinatario>
		<destinatario>meli@gmail.com</destinatario>
		<fecha>
			<dia>26</dia>
			<mes>01</mes>
			<anyo>2021</anyo>
		</fecha>
		<asunto>Prueba de mensajes</asunto>
		<mensaje/>
		<fichero>
			<nombre>informe.pdf</nombre>
			<tipo>aplication/pdf</tipo>
		</fichero>
		<fichero>
			<nombre>foto.jpg</nombre>
			<tipo>image/jpeg</tipo>
		</fichero>
	</mail>